{
  "schemaVersion": "1",
  "kind": "maxwell.session.meta",
  "sessionId": "ses_f557eddeeffef85eL1I2TNbMBs",
  "harness": "opencode",
  "harnessVersion": "1.18.30",
  "runId": "run_01M2GDZ3Q3S5WYCB3MV02QJXZ1",
  "workflow": "probe-cicd-env",
  "companyId": "example-co",
  "args": {
    "appIds": [],
    "envIds": [],
    "dryRun": false
  },
  "startedAt": "2026-09-16T13:56:24Z",
  "cwd": "/home/priyesh/.cache/maxwell-e2e/opencode-wt",
  "gitBranch": "e2e-opencode",
  "gitCommit": "18385378264df40b766b7e2e8d422ed62ee29966",
  "transcriptPath": "kpis/data/raw/sessions/opencode/ses_f557eddeeffef85eL1I2TNbMBs.jsonl",
  "sampled": true,
  "samplingReason": "forced",
  "model": "unknown",
  "invokedBy": {
    "type": "script",
    "id": "headless"
  },
  "provenance": {
    "harness": "script",
    "generatedAt": "2026-09-16T13:56:24Z",
    "sessionId": "ses_f557eddeeffef85eL1I2TNbMBs",
    "runId": "run_01M2GDZ3Q3S5WYCB3MV02QJXZ1",
    "agent": "hooks/session-start"
  },
  "endedAt": "2026-09-16T14:09:07Z",
  "exportPath": "kpis/data/raw/sessions/opencode/ses_f557eddeeffef85eL1I2TNbMBs.export.json"
}
