{
  "schemaVersion": "1",
  "kind": "maxwell.session.meta",
  "sessionId": "ses_f585e12d8ffeQ5xIaZ6GAdTF7s",
  "harness": "opencode",
  "harnessVersion": "1.18.30",
  "runId": "run_01M2GDZ3Q3S5WYCB3MV02QJXZ1",
  "workflow": "impl-change-management",
  "companyId": "example-co",
  "args": {
    "appIds": [],
    "envIds": [],
    "dryRun": false
  },
  "startedAt": "2026-09-16T00:33:22Z",
  "cwd": "/home/priyesh/.cache/maxwell-e2e/opencode-wt",
  "gitBranch": "e2e-opencode",
  "gitCommit": "9ceeaa2967422b4354f48bfc129683e998a0133e",
  "transcriptPath": "kpis/data/raw/sessions/opencode/ses_f585e12d8ffeQ5xIaZ6GAdTF7s.jsonl",
  "sampled": true,
  "samplingReason": "forced",
  "model": "unknown",
  "invokedBy": {
    "type": "script",
    "id": "headless"
  },
  "provenance": {
    "harness": "script",
    "generatedAt": "2026-09-16T00:33:22Z",
    "sessionId": "ses_f585e12d8ffeQ5xIaZ6GAdTF7s",
    "runId": "run_01M2GDZ3Q3S5WYCB3MV02QJXZ1",
    "agent": "hooks/session-start"
  },
  "endedAt": "2026-09-16T00:36:42Z",
  "exportPath": "kpis/data/raw/sessions/opencode/ses_f585e12d8ffeQ5xIaZ6GAdTF7s.export.json"
}
