{
  "schemaVersion": "1",
  "kind": "maxwell.session.meta",
  "sessionId": "ses_f5b5c6c57ffeUm6ObssJT8MweL",
  "harness": "opencode",
  "harnessVersion": "1.18.30",
  "runId": "run_01M2GDZ3Q3S5WYCB3MV02QJXZ1",
  "workflow": "probe-cicd-env",
  "companyId": "example-co",
  "args": {
    "appIds": [],
    "envIds": [],
    "dryRun": false
  },
  "startedAt": "2026-09-15T10:36:18Z",
  "cwd": "/home/priyesh/.cache/maxwell-e2e/opencode-wt",
  "gitBranch": "e2e-opencode",
  "gitCommit": "cb9facf400dc6e1583ecceb417e41fbe77c1a7d0",
  "transcriptPath": "kpis/data/raw/sessions/opencode/ses_f5b5c6c57ffeUm6ObssJT8MweL.jsonl",
  "sampled": true,
  "samplingReason": "forced",
  "model": "unknown",
  "invokedBy": {
    "type": "script",
    "id": "headless"
  },
  "provenance": {
    "harness": "script",
    "generatedAt": "2026-09-15T10:36:18Z",
    "sessionId": "ses_f5b5c6c57ffeUm6ObssJT8MweL",
    "runId": "run_01M2GDZ3Q3S5WYCB3MV02QJXZ1",
    "agent": "hooks/session-start"
  },
  "endedAt": "2026-09-15T10:48:38Z",
  "exportPath": "kpis/data/raw/sessions/opencode/ses_f5b5c6c57ffeUm6ObssJT8MweL.export.json"
}
