{
  "schemaVersion": "1",
  "kind": "maxwell.session.meta",
  "sessionId": "ses_f5d549699ffeRlfLD6LGgzqG0E",
  "harness": "opencode",
  "harnessVersion": "1.18.30",
  "runId": "run_01M2GDZ3Q3S5WYCB3MV02QJXZ1",
  "workflow": "probe-iac",
  "companyId": "example-co",
  "args": {
    "appIds": [],
    "envIds": [],
    "dryRun": false
  },
  "startedAt": "2026-09-15T01:25:37Z",
  "cwd": "/home/priyesh/.cache/maxwell-e2e/opencode-wt",
  "gitBranch": "e2e-opencode",
  "gitCommit": "8304e9058dfe25559e5b13b474ccd3fbea51abca",
  "transcriptPath": "kpis/data/raw/sessions/opencode/ses_f5d549699ffeRlfLD6LGgzqG0E.jsonl",
  "sampled": true,
  "samplingReason": "forced",
  "model": "unknown",
  "invokedBy": {
    "type": "script",
    "id": "headless"
  },
  "provenance": {
    "harness": "script",
    "generatedAt": "2026-09-15T01:25:37Z",
    "sessionId": "ses_f5d549699ffeRlfLD6LGgzqG0E",
    "runId": "run_01M2GDZ3Q3S5WYCB3MV02QJXZ1",
    "agent": "hooks/session-start"
  },
  "endedAt": "2026-09-15T01:35:18Z",
  "exportPath": "kpis/data/raw/sessions/opencode/ses_f5d549699ffeRlfLD6LGgzqG0E.export.json"
}
