{
  "schemaVersion": "1",
  "kind": "maxwell.session.meta",
  "sessionId": "ses_f59ad3222ffe1bxhgT4OcK5cN2",
  "harness": "opencode",
  "harnessVersion": "1.18.30",
  "runId": "run_01M2GDZ3Q3S5WYCB3MV02QJXZ1",
  "workflow": "probe-agent-graph",
  "companyId": "example-co",
  "args": {
    "appIds": [],
    "envIds": [],
    "dryRun": false
  },
  "startedAt": "2026-09-15T18:27:19Z",
  "cwd": "/home/priyesh/.cache/maxwell-e2e/opencode-wt",
  "gitBranch": "e2e-opencode",
  "gitCommit": "f3a0f04b14e3fe810ac9bdc54478919cbf906c07",
  "transcriptPath": "kpis/data/raw/sessions/opencode/ses_f59ad3222ffe1bxhgT4OcK5cN2.jsonl",
  "sampled": true,
  "samplingReason": "forced",
  "model": "unknown",
  "invokedBy": {
    "type": "script",
    "id": "headless"
  },
  "provenance": {
    "harness": "script",
    "generatedAt": "2026-09-15T18:27:19Z",
    "sessionId": "ses_f59ad3222ffe1bxhgT4OcK5cN2",
    "runId": "run_01M2GDZ3Q3S5WYCB3MV02QJXZ1",
    "agent": "hooks/session-start"
  },
  "endedAt": "2026-09-15T18:35:11Z",
  "exportPath": "kpis/data/raw/sessions/opencode/ses_f59ad3222ffe1bxhgT4OcK5cN2.export.json"
}
