{
  "schemaVersion": "1",
  "kind": "maxwell.session.meta",
  "sessionId": "ses_f58d20039ffeE8NqCc62rtTl22",
  "harness": "opencode",
  "harnessVersion": "1.18.30",
  "runId": "run_01M2GDZ3Q3S5WYCB3MV02QJXZ1",
  "workflow": "execute-scr",
  "companyId": "example-co",
  "args": {
    "appIds": [],
    "envIds": [],
    "dryRun": false
  },
  "startedAt": "2026-09-15T22:26:44Z",
  "cwd": "/home/priyesh/.cache/maxwell-e2e/opencode-wt",
  "gitBranch": "e2e-opencode",
  "gitCommit": "e1aeab26e780027dbdc942c3f88acab4c79de8a7",
  "transcriptPath": "kpis/data/raw/sessions/opencode/ses_f58d20039ffeE8NqCc62rtTl22.jsonl",
  "sampled": true,
  "samplingReason": "forced",
  "model": "unknown",
  "invokedBy": {
    "type": "script",
    "id": "headless"
  },
  "provenance": {
    "harness": "script",
    "generatedAt": "2026-09-15T22:26:44Z",
    "sessionId": "ses_f58d20039ffeE8NqCc62rtTl22",
    "runId": "run_01M2GDZ3Q3S5WYCB3MV02QJXZ1",
    "agent": "hooks/session-start"
  },
  "endedAt": "2026-09-15T22:29:35Z",
  "exportPath": "kpis/data/raw/sessions/opencode/ses_f58d20039ffeE8NqCc62rtTl22.export.json"
}
